Name,Dataset 1,Dataset 2,Dataset 3,Dataset 4
Name,SRPBS Multi-disorder Connectivity Dataset,SRPBS Multi-disorder MRI Dataset,SRPBS Multi-disorder MRI Dataset,SRPBS Traveling Subject MRI Dataset
Synapse ID,syn22317076,syn22317076,syn22317076,syn22317076
Availability,Application and approval required,Application and approval required,Registration required,Registration required
DOI,10.7303/syn22317078,10.7303/syn22317079,10.7303/syn22317081,10.7303/syn22317082
Summary of contents,1) Resting state functional connectivity matrix (.mat file)2) Participant demographics3) README (with MRI protocols),"1) Brain imaging dataset (NIFTI)– rsfmri, T1w, fieldmap2) Participant demographics3) README4) MRI protocols5) QC results","1) Brain imaging dataset (NIFTI)– rsfmri, T1w, fieldmap2) Participant demographics3) README4) MRI protocols5) QC results","1) Brain imaging dataset (NIFTI with BIDS)– rsfmri, T1w, fieldmap2) Participant demographica3) README4) MRI protocols5) QC results"
Details of contents,Details of contents,Details of contents,Details of contents,Details of contents
MRI,Each consortium site generated one.mat file containing the values of functional connectivity for each participant [number of participants × number of functional connectivities],"Each of 1,627 subject folders contains- rsfmri (resting-state fMRI EPI images)- t1 (T1-weighted structural image)- fmap (field-map, optional)","Each of 1,410 subject folders contains- rsfmri (resting-state fMRI EPI images)- t1 (T1-weighted structural image)- fmap (field-map, optional)","Each of 143 session folders contain- func (resting-state fMRI EPI images)- anat (T1-weighted structural image)- fmap (field-map, optional)"
Demographics,"subject ID, age, sex, handedness, diagnosis, auxiliary demographic information, rate of excluded volume, number of excluded volume","subject ID, age, sex, handedness, diagnosis, auxiliary demographic information","subject ID, age, sex, handedness, diagnosis, auxiliary demographic information","BIDS ID, subject ID, site, number of repetitions, phase encoding, MRI manufacturer, number of coils, scanner, session id, sex, age"
