Connection,CC Patients,CC Controls,T
Globus Pallidus L to SMA L,0.051 ± 0.185,0.259 ± 0.197,2.99
Globus Pallidus L to Dorsal Premotor Area R,0.052 ± 0.225,0.178 ± 0.193,3.24
Caudatum L to Pre-SMA L,0.19 ± 0.174,0.355 ± 0.158,2.58
Caudatum L to Pre-SMA R,0.068 ± 0.167,0.294 ± 0.193,3.26
Gl. Pallidus R to SMA R,0.109 ± 0.167,0.194 ± 0.189,2.67
Gl. Pallidus R to Dorsal Premotor Area R,0.072 ± 0.147,0.187 ± 0.195,2.9
Putamen R to SMA R,0.125 ± 0.243,0.318 ± 0.224,2.63
Putamen R to Dorsal Premotor Area R,−0.037 ± 0.271,0.230 ± 0.166,2.97
SMA R to Postcentral Gyrus R,0.224 ± 0.261,0.362 ± 0.176,2.61
