Anatomical Regions,Abbr.,BA,MNI Coordinates,MNI Coordinates,MNI Coordinates,Cluster Size,Maximal t Value
Unnamed: 0_level_1,Unnamed: 1_level_1,Unnamed: 2_level_1,X,Y,Z,Unnamed: 6_level_1,Unnamed: 7_level_1
JME >HCs,,,,,,,
Left cerebellum posterior lobe (Cerebellar Tonsil),CePL.L,-,−3,−51,−48,48.0,3.54
Right inferior temporal gyrus,ITG.R,20,39,−12,−29,133.0,5.42
Right superior frontal gyrus,SFG.R,8,15,48,51,64.0,4.11
JME < HCs,,,,,,,
Left inferior frontal gyrus,IFG.L,47,−45,36,−12,213.0,−4.47
Left superior temporal gyrus,STG.L,40,−63,−33,15,234.0,−4.72
